{
  "gateEvaluationId": "11111111-1111-1111-1111-111111111111",
  "runId": "22222222-2222-2222-2222-222222222222",
  "jurisdictionKey": "ca_statewide",
  "stageCode": "swppp.noi_ready",
  "status": "blocked",
  "requirements": [
    {
      "code": "document.swppp_eauthorization",
      "kind": "document",
      "status": "unmet",
      "message": "SMARTS eAuthorization evidence is missing.",
      "evidenceRefs": []
    },
    {
      "code": "field.project.swppp.lrp_name",
      "kind": "field",
      "status": "met",
      "message": "LRP name captured.",
      "evidenceRefs": [
        "field:project.swppp.lrp_name"
      ]
    }
  ],
  "blockers": [
    {
      "code": "SWPPP_EAUTH_MISSING",
      "message": "SMARTS eAuthorization evidence is required before NOI readiness."
    }
  ],
  "waiverEligible": false,
  "ruleSnapshotRef": "snapshot:swppp.noi.requires_signer_controls@2026-03-22"
}